company_name,mst,company_representative,address,href
DOANH NGHIỆP TN HOÀNG KIM PHÚC,1601487051,LÊ THỊ TRANG," Số 73 Quản Cơ Thành, Phường Bình Khánh, Thành phố Long Xuyên , Tỉnh An Giang, Việt Nam",https://masothue.com/1601487051-doanh-nghiep-tn-hoang-kim-phuc
CHI NHÁNH DOANH NGHIỆP TN HOÀNG KIM PHÚC - HOÀNG KIM PHÚC 2,1601487051-001,LÊ THỊ TRANG," Số 509-26 Quản Cơ Thành, Phường Bình Khánh, Thành phố Long Xuyên , Tỉnh An Giang, Việt Nam",https://masothue.com/1601487051-001-chi-nhanh-doanh-nghiep-tn-hoang-kim-phuc-hoang-kim-phuc-2
DOANH NGHIỆP TN MASSAGE THIÊN TÂN,1401314830,LÊ THỊ TƯỜNG VI," Số 272, khóm 2, Thị Trấn Lai Vung, Huyện Lai Vung, Tỉnh Đồng Tháp, Việt Nam",https://masothue.com/1401314830-doanh-nghiep-tn-massage-thien-tan
DOANH NGHIỆP TƯ NHÂN THUẬN PHÁT,1200103325,PHÓ HÒA THUẬN," Số 10 Nguyễn Huệ, Phường 1, Thành phố Mỹ Tho, Tỉnh Tiền Giang, Việt Nam",https://masothue.com/1200103325-doanh-nghiep-tu-nhan-thuan-phat
DOANH NGHIỆP TN THIÊN PHÚ MASAGE,1401628925,LÊ QUANG PHÚ," Số 956A, Tổ 24, Quốc lộ 80, Ấp Tân Thuận, Xã Tân Nhuận Đông, Huyện Châu Thành, Tỉnh Đồng Tháp, Việt Nam",https://masothue.com/1401628925-doanh-nghiep-tn-thien-phu-masage
CÔNG TY TNHH MINH ĐẠI NAM,0401409181,NGUYỄN VĂN TUẤN," 457/14 Hà Huy Tập, Phường An Khê, Quận Thanh Khê, Thành phố Đà Nẵng, Việt Nam",https://masothue.com/0401409181-cong-ty-tnhh-minh-dai-nam
CÔNG TY TNHH MỘT THÀNH VIÊN THẨM MỸ NGỌC BÍCH,3602859997,NGUYỄN THỊ NGỌC BÍCH," Số 5, Lê Thánh Tôn, Phường Thanh Bình, Thành phố Biên Hoà, Tỉnh Đồng Nai, Việt Nam",https://masothue.com/3602859997-cong-ty-tnhh-mot-thanh-vien-tham-my-ngoc-bich
CHI NHÁNH CÔNG TY CỔ PHẦN BỆNH VIỆN HỮU NGHỊ QUỐC TẾ HÀ NỘI TẠI PLEIKU,0106027241-005,HOÀNG MỸ HẠNH," 24 Trần Phú, Phường Tây Sơn, Thành phố Pleiku, Tỉnh Gia Lai, Việt Nam",https://masothue.com/0106027241-005-chi-nhanh-cong-ty-co-phan-benh-vien-huu-nghi-quoc-te-ha-noi-tai-pleiku
CÔNG TY TNHH HƯNG NGHIỆP HOA SEN,0106903562,TRẦN THỤC PHỤNG," TT2.14 Khu đô thị Cổ Nhuế , Phường Cổ Nhuế 1, Quận Bắc Từ Liêm, Thành phố Hà Nội, Việt Nam",https://masothue.com/0106903562-cong-ty-tnhh-hung-nghiep-hoa-sen
CÔNG TY TNHH HỒNG NGUYỆT ĐƯỜNG,0106993171,HỒNG HOÀN ," Số 16 lô M1, phố Trần Kim Xuyến , Phường Yên Hoà, Quận Cầu Giấy, Thành phố Hà Nội, Việt Nam",https://masothue.com/0106993171-cong-ty-tnhh-hong-nguyet-duong
CÔNG TY TNHH DR.BẢO,0107144011,PHẠM THU HIỀN," Số 15, ngõ 4, phố Quần Ngựa, Phường Liễu Giai, Quận Ba Đình, Thành phố Hà Nội, Việt Nam",https://masothue.com/0107144011-cong-ty-tnhh-dr-bao
CHI NHÁNH SỐ 2 - CÔNG TY TNHH MỘT THÀNH VIÊN MASSAGE HOÀNG DIỄM,3603043288-002,NGUYỄN TUẤN NHÂN," Số 24/118, KP 2, Phường Tân Mai, Thành phố Biên Hoà, Tỉnh Đồng Nai, Việt Nam",https://masothue.com/3603043288-002-chi-nhanh-so-2-cong-ty-tnhh-mot-thanh-vien-massage-hoang-diem
CÔNG TY TNHH DỊCH VỤ CÁNH GIÓ ĐÔNG,0401795843,VĂN VĨNH ẨN LONG," 80 Dương Tự Minh, Phường Phước Mỹ, Quận Sơn Trà, Thành phố Đà Nẵng, Việt Nam",https://masothue.com/0401795843-cong-ty-tnhh-dich-vu-canh-gio-dong
CÔNG TY TNHH MỘT THÀNH VIÊN DV THÀNH TÚ,2100627341,NGUYỄN THÀNH TÚ," khóm 2, Thị Trấn Tiểu Cần, Huyện Tiểu Cần, Tỉnh Trà Vinh, Việt Nam",https://masothue.com/2100627341-cong-ty-tnhh-mot-thanh-vien-dv-thanh-tu
CÔNG TY TNHH MỘT THÀNH VIÊN MASSAGE 777,3702410404,ĐOÀN THÀNH LẬP," Số 246, đường 30 tháng 4, khu 12, Phường Chánh Nghĩa, Thành phố Thủ Dầu Một, Tỉnh Bình Dương, Việt Nam",https://masothue.com/3702410404-cong-ty-tnhh-mot-thanh-vien-massage-777
DOANH NGHIỆP TN ĐAN BEAUTY,0107893927,PHẠM QUỲNH NƯƠNG," Số 22 Ngõ 26 Nguyên Hồng, Phường Láng Hạ, Quận Đống Đa, Thành phố Hà Nội, Việt Nam",https://masothue.com/0107893927-doanh-nghiep-tn-dan-beauty
CÔNG TY TNHH ĐẦU TƯ THƯƠNG MẠI VÀ DỊCH VỤ 3M,3502337958,NGUYỄN THỊ MINH NGỌC," Số 270A Trương Công Định, Phường 3, Thành phố Vũng Tàu, Tỉnh Bà Rịa - Vũng Tàu, Việt Nam",https://masothue.com/3502337958-cong-ty-tnhh-dau-tu-thuong-mai-va-dich-vu-3m
DOANH NGHIỆP TƯ NHÂN THƯƠNG MẠI - XÂY DỰNG - DỊCH VỤ TỔNG HỢP KIM HOÀNG GIA,4101226272,VÕ THỊ KIỀU OANH," Số 85, Đường Chương Dương, Phường Nguyễn Văn Cừ, Thành phố Quy Nhơn, Tỉnh Bình Định, Việt Nam",https://masothue.com/4101226272-doanh-nghiep-tu-nhan-thuong-mai-xay-dung-dich-vu-tong-hop-kim-hoang-gia
CÔNG TY TNHH MTV XIN CHÀO MASSAGE & SPA,0401885857,NGUYỄN THỊ MỸ LINH," 46 Hà Bổng, Phường Phước Mỹ, Quận Sơn Trà, Thành phố Đà Nẵng, Việt Nam",https://masothue.com/0401885857-cong-ty-tnhh-mtv-xin-chao-massage-spa
CÔNG TY TNHH DV - TH CAO CƯỜNG 555,2802568369,Nguyễn Cao Cường," SN 124, đường Trường Thi, Phường Trường Thi, Thành phố Thanh Hoá, Tỉnh Thanh Hoá, Việt Nam",https://masothue.com/2802568369-cong-ty-tnhh-dv-th-cao-cuong-555
CÔNG TY TRÁCH NHIỆM HỮU HẠN CELINA SPA CLINIC,3502348029,NGUYỄN LÊ HOÀNG OANH," Số 234 Lê Lợi, Phường 4, Thành phố Vũng Tàu, Tỉnh Bà Rịa - Vũng Tàu, Việt Nam",https://masothue.com/3502348029-cong-ty-trach-nhiem-huu-han-celina-spa-clinic
CHI NHÁNH CÔNG TY CỔ PHẦN Y VƯƠNG,0315123742-001,PANG MỸ LINH," 104/21 Mai Thị Lựu, Phường Đa Kao, Quận 1, Thành phố Hồ Chí Minh, Việt Nam",https://masothue.com/0315123742-001-chi-nhanh-cong-ty-co-phan-y-vuong
CHI NHÁNH TP ĐÀ NẴNG - CÔNG TY TNHH MONICA,0311560420-003,TRẦN TIỂU LIÊN," 46 Thái Phiên, Phường Phước Ninh, Quận Hải Châu, Thành phố Đà Nẵng, Việt Nam",https://masothue.com/0311560420-003-chi-nhanh-tp-da-nang-cong-ty-tnhh-monica
CÔNG TY CỔ PHẦN VYOGA ĐÁ MUỐI HVG,5901102214,PHẠM THỊ THU HÀ," 44 Quyết Tiến, Phường Ia Kring, Thành phố Pleiku, Tỉnh Gia Lai, Việt Nam",https://masothue.com/5901102214-cong-ty-co-phan-vyoga-da-muoi-hvg
CÔNG TY TNHH THƯƠNG MẠI VÀ ĐẦU TƯ AN PHONG,0107884513,VŨ THỊ THỦY," Số nhà 14D ngõ 157/31 phố Pháo Đài Láng, Phường Láng Thượng, Quận Đống Đa, Thành phố Hà Nội, Việt Nam",https://masothue.com/0107884513-cong-ty-tnhh-thuong-mai-va-dau-tu-an-phong
CÔNG TY TNHH GEMMA SPA VIỆT NAM,0107613785,BÙI THỊ HOA," Số 138 Trần Bình, Phường Mỹ Đình 2, Quận Nam Từ Liêm, Thành phố Hà Nội, Việt Nam",https://masothue.com/0107613785-cong-ty-tnhh-gemma-spa-viet-nam
CÔNG TY TNHH ANTHONY LÂM,0108262138,LÂM VĂN ÚT," Số nhà 396 Khâm Thiên, Phường Thổ Quan, Quận Đống Đa, Thành phố Hà Nội, Việt Nam",https://masothue.com/0108262138-cong-ty-tnhh-anthony-lam
CÔNG TY TNHH MOON SPA,4201783037,NGUYỄN THỊ TÚ ANH," 1030/16A Lê Hồng Phong, Phường Phước Long, Thành phố Nha Trang, Tỉnh Khánh Hòa, Việt Nam",https://masothue.com/4201783037-cong-ty-tnhh-moon-spa
NGỌC HÀ BEAUTY CARE-CHI NHÁNH CÔNG TY TNHH SONG ANH HANA,0107540167-002,NGUYỄN HUY NGỌC," Số 12 ngõ 172 Lạc Long Quân, Phường Bưởi, Quận Tây Hồ, Thành phố Hà Nội, Việt Nam",https://masothue.com/0107540167-002-ngoc-ha-beauty-care-chi-nhanh-cong-ty-tnhh-song-anh-hana
CÔNG TY TRÁCH NHIỆM HỮU HẠN MỘT THÀNH VIÊN CHIẾT THƯƠNG,0401998681,LÊ VĂN TRÁNG," 04 Hà Bổng, Phường Phước Mỹ, Quận Sơn Trà, Thành phố Đà Nẵng, Việt Nam",https://masothue.com/0401998681-cong-ty-trach-nhiem-huu-han-mot-thanh-vien-chiet-thuong
CÔNG TY TRÁCH NHIỆM HỮU HẠN THƯƠNG MẠI DỊCH VỤ VŨNG TÀU XANH,3502130551,Huỳnh Thị Kim Phương," Số 34F Nguyễn Trường Tộ, Phường 3, Thành phố Vũng Tàu, Tỉnh Bà Rịa - Vũng Tàu, Việt Nam",https://masothue.com/3502130551-cong-ty-trach-nhiem-huu-han-thuong-mai-dich-vu-vung-tau-xanh
DOANH NGHIỆP TƯ NHÂN LỆ CHI NGUYÊN,3702044934,MẠC SI MÚI," DC 38-25, KDC Việt Sing, Phường An Phú, Thành phố Thuận An, Tỉnh Bình Dương, Việt Nam",https://masothue.com/3702044934-doanh-nghiep-tu-nhan-le-chi-nguyen
DOANH NGHIỆP TƯ NHÂN DỊCH VỤ MASSAGE HỌA MY,0105511308,LÊ THỊ XINH," Số 259, phố Bùi Xương Trạch, Phường Khương Đình, Quận Thanh Xuân, Thành phố Hà Nội, Việt Nam",https://masothue.com/0105511308-doanh-nghiep-tu-nhan-dich-vu-massage-hoa-my
CÔNG TY TNHH LÊ MINH TRANG,0105480233,LÊ THU TRANG," Km8+500 Đại Lộ Thăng Long, Xã An Khánh, Huyện Hoài Đức, Thành phố Hà Nội, Việt Nam",https://masothue.com/0105480233-cong-ty-tnhh-le-minh-trang
DOANH NGHIỆP TN MASSAGE XUÂN MAI,1401300965,LÊ THỊ BÍCH NGA," Số 33, Lê Quý Đôn, Phường 1, Thành phố Cao Lãnh, Tỉnh Đồng Tháp, Việt Nam",https://masothue.com/1401300965-doanh-nghiep-tn-massage-xuan-mai
DOANH NGHIỆP TN ĐẠI DƯƠNG,1600975112,VÕ TÂN THANH," Số 262 Tôn Đức Thắng, khóm Long Thạnh D, Phường Long Thạnh, Thị xã Tân Châu, Tỉnh An Giang, Việt Nam",https://masothue.com/1600975112-doanh-nghiep-tn-dai-duong
DOANH NGHIỆP TN ĐANG PHÁT,1601497564,QUÁCH THỊ NGHỆ," Số 42/36 Trần Hưng Đạo, Phường Mỹ Thới, Thành phố Long Xuyên , Tỉnh An Giang, Việt Nam",https://masothue.com/1601497564-doanh-nghiep-tn-dang-phat
CÔNG TY TNHH MỘT THÀNH VIÊN HOÀNG CÁT VÀNG,3701825205,TRƯƠNG THỊ THU," 35A/1 khu phố Đông Nhì, Thị Trấn Lái Thiêu, Thành phố Thuận An, Tỉnh Bình Dương, Việt Nam",https://masothue.com/3701825205-cong-ty-tnhh-mot-thanh-vien-hoang-cat-vang
CHI NHÁNH CÔNG TY CỔ PHẦN Y KHOA & THẨM MỸ THU CÚC - THU CUC CLINIC 07,0102624215-005,TẠ TẤT THÀNH," 2182 đường Hùng Vương, Phường Vân Cơ, Thành phố Việt Trì, Tỉnh Phú Thọ, Việt Nam",https://masothue.com/0102624215-005-chi-nhanh-cong-ty-co-phan-y-khoa-tham-my-thu-cuc-thu-cuc-clinic-07
CÔNG TY TNHH THƯƠNG MẠI DỊCH VỤ SUNNY VIỆT NAM,0108421606,TRẦN DUY PHƯƠNG," Tầng 1, Tầng 2, Số 13, Phố Phạm Hồng Thái, Phường Nguyễn Trung Trực, Quận Ba Đình, Thành phố Hà Nội, Việt Nam",https://masothue.com/0108421606-cong-ty-tnhh-thuong-mai-dich-vu-sunny-viet-nam
CÔNG TY TNHH CHĂM SÓC SẮC ĐẸP LY HOUSE,1801620215,HỒ YẾN LY," Số 310, Đường 30/4, Phường Xuân Khánh, Quận Ninh Kiều, Thành phố Cần Thơ, Việt Nam",https://masothue.com/1801620215-cong-ty-tnhh-cham-soc-sac-dep-ly-house
CÔNG TY TNHH THƯƠNG MẠI DỊCH VỤ BIK,0315957515,LƯƠNG CAO HOÀNG BẢO," 92/9 Nguyễn Tuyển, Phường Bình Trưng Tây, Quận 2, Thành phố Hồ Chí Minh, Việt Nam",https://masothue.com/0315957515-cong-ty-tnhh-thuong-mai-dich-vu-bik
CÔNG TY CỔ PHẦN THƯƠNG MẠI DỊCH VỤ VÀ LÀM ĐẸP EVA XINH,0106879775,ĐỖ THỊ THU TRANG," Số 4, ngõ 68 Ngụy Như Kon Tum, Phường Nhân Chính, Quận Thanh Xuân, Thành phố Hà Nội, Việt Nam",https://masothue.com/0106879775-cong-ty-co-phan-thuong-mai-dich-vu-va-lam-dep-eva-xinh
CÔNG TY CỔ PHẦN ĐẦU TƯ THƯƠNG MẠI LIÊN THẢO,0110155743,LÊ THỊ MỸ LINH," Số 26, ngõ 1 phố Nguyễn Thị Định, Phường Trung Hoà, Quận Cầu Giấy, Thành phố Hà Nội, Việt Nam",https://masothue.com/0110155743-cong-ty-co-phan-dau-tu-thuong-mai-lien-thao
CHI NHÁNH DOANH NGHIỆP TƯ NHÂN TRIỀU CHÂU,1500474585-001,NGUYỄN TUYẾT MAI," Số 118 Trưng Nữ Vương, Khóm Châu Thới, Phường Châu Phú B, Thành phố Châu Đốc, Tỉnh An Giang, Việt Nam",https://masothue.com/1500474585-001-chi-nhanh-doanh-nghiep-tu-nhan-trieu-chau
NGỌC LINH FOOT MASSAGE - CHI NHÁNH CÔNG TY TNHH LINH SPORT,0401408822-001,NGUYỄN NGỌC LINH," 233- Trần Phú, Phường Phước Ninh, Quận Hải Châu, Thành phố Đà Nẵng, Việt Nam",https://masothue.com/0401408822-001-ngoc-linh-foot-massage-chi-nhanh-cong-ty-tnhh-linh-sport
CÔNG TY TNHH DỊCH VỤ VÀ ĐÀO TẠO THẲM MỸ CALI HÀ NỘI,0107103262,Nguyễn Tuấn Anh," Số 138 Trần Bình, Phường Mỹ Đình 2, Quận Nam Từ Liêm, Thành phố Hà Nội, Việt Nam",https://masothue.com/0107103262-cong-ty-tnhh-dich-vu-va-dao-tao-tham-my-cali-ha-noi
HÂN ANH SPA - CÔNG TY TNHH XUẤT NHẬP KHẨU THƯƠNG MẠI LINH ANH,0104763398-002,ĐỖ THỊ THANH HUYỀN," Số 25, ngõ 168/23 Hào Nam, Phường Ô Chợ Dừa, Quận Đống Đa, Thành phố Hà Nội, Việt Nam",https://masothue.com/0104763398-002-han-anh-spa-cong-ty-tnhh-xuat-nhap-khau-thuong-mai-linh-anh
CÔNG TY CỔ PHẦN CHĂM SÓC SỨC KHỎE VÀ LÀM ĐẸP MIMOSA,0108156154,NGUYỄN VIỆT TUYẾN," Số 16, phố Thái Thịnh, Phường Ngã Tư Sở, Quận Đống Đa, Thành phố Hà Nội, Việt Nam",https://masothue.com/0108156154-cong-ty-co-phan-cham-soc-suc-khoe-va-lam-dep-mimosa
CHI NHÁNH III - CÔNG TY CỔ PHẦN QUỐC TẾ LOUIS BEAUTY VIỆT NAM TẠI QUẢNG NGÃI,5901066044-004,ĐINH THỊ THANH LOAN," 111 Quang Trung, Phường Lê Hồng Phong, Thành phố Quảng Ngãi, Tỉnh Quảng Ngãi, Việt Nam",https://masothue.com/5901066044-004-chi-nhanh-iii-cong-ty-co-phan-quoc-te-louis-beauty-viet-nam-tai-quang-ngai
CHI NHÁNH CÔNG TY TNHH ĐÀO TẠO THẨM MỸ CA LI TẠI HÀ NỘI,0309575765-003,HOÀNG THỊ MỸ HỒNG," Số nhà 22 đường Thụy Khuê, Phường Thuỵ Khuê, Quận Tây Hồ, Thành phố Hà Nội, Việt Nam",https://masothue.com/0309575765-003-chi-nhanh-cong-ty-tnhh-dao-tao-tham-my-ca-li-tai-ha-noi
DOANH NGHIỆP TƯ NHÂN DỊCH VỤ MI MI - CHI NHÁNH HÀ NỘI,0302315990-002,NGUYỄN THỊ DIỄM HẰNG," Tầng 2 và 3 tòa nhà số 22 ngách 264/32 đường Thụy Khuê, Phường Thuỵ Khuê, Quận Tây Hồ, Thành phố Hà Nội, Việt Nam",https://masothue.com/0302315990-002-doanh-nghiep-tu-nhan-dich-vu-mi-mi-chi-nhanh-ha-noi
CÔNG TY TNHH CHĂM SÓC DA Y HỌC CỔ TRUYỀN KIM THẢO Y ĐƯỜNG,0108174121,Nguyễn Thị Kim Lan," Số 24 phố Tăng Bạt Hổ, Phường Phạm Đình Hổ, Quận Hai Bà Trưng, Thành phố Hà Nội, Việt Nam",https://masothue.com/0108174121-cong-ty-tnhh-cham-soc-da-y-hoc-co-truyen-kim-thao-y-duong
CÔNG TY TRÁCH NHIỆM HỮU HẠN TMDV MINA,5801506929,NGUYỄN THỊ HẰNG," 38 Lương Thế Vinh, Phường 3, Thành phố Đà Lạt, Tỉnh Lâm Đồng, Việt Nam",https://masothue.com/5801506929-cong-ty-trach-nhiem-huu-han-cong-ty-tnhh-tmdv-mina
CÔNG TY TNHH MỘT THÀNH VIÊN LONG HOÀNG THẠCH,0401886459,Trần Công Thành," 115 Nguyễn Đỗ Cung, Phường Hoà Minh, Quận Liên Chiểu, Thành phố Đà Nẵng, Việt Nam",https://masothue.com/0401886459-cong-ty-tnhh-mot-thanh-vien-long-hoang-thach
CHI NHÁNH CÔNG TY TRÁCH NHIỆM HỮU HẠN MỘT THÀNH VIÊN THƯƠNG MẠI VÀ DỊCH VỤ YẾN NHI - CƠ SỞ I,3300871123-001,PHAN HOÀNG NHỚ," Thôn Ngọc Anh, Xã Phú Thượng, Huyện Phú Vang, Tỉnh Thừa Thiên Huế, Việt Nam",https://masothue.com/3300871123-001-chi-nhanh-cong-ty-trach-nhiem-huu-han-mot-thanh-vien-thuong-mai-va-dich-vu-yen-nhi-co-so-i
CHI NHÁNH 3 DOANH NGHIỆP TƯ NHÂN PHI HÙNG,3900879237-003,LÂM PHI HÙNG," Tổ 17, Khu phố 3, Thị Trấn Tân Biên, Huyện Tân Biên, Tỉnh Tây Ninh, Việt Nam",https://masothue.com/3900879237-003-chi-nhanh-3-doanh-nghiep-tu-nhan-phi-hung
CÔNG TY TNHH DỊCH VỤ MASSAGE TÔ CHÂU,1102018625,NGUYỄN HUỲNH NHƯ NGỌC," 129 Quốc Lộ 62, Phường 6, Thành phố Tân An, Tỉnh Long An, Việt Nam",https://masothue.com/1102018625-cong-ty-tnhh-dich-vu-massage-to-chau
CÔNG TY TNHH DU LỊCH VÀ DỊCH VỤ LÊ YÊN,0107261396,Lê Thị Yên," lô LK 03 vị trí 32 KĐT Đại Thanh, Xã Tả Thanh Oai, Huyện Thanh Trì, Thành phố Hà Nội, Việt Nam",https://masothue.com/0107261396-cong-ty-tnhh-du-lich-va-dich-vu-le-yen
CÔNG TY HOA THẢO – (TNHH),2300226964,Trần Thị Lệ Hoa," Số 84, đường Rạp Hát, khu Thị Trung, Phường Kinh Bắc, Thành phố Bắc Ninh, Tỉnh Bắc Ninh, Việt Nam",https://masothue.com/2300226964-cong-ty-hoa-thao-tnhh
CÔNG TY TNHH THƯƠNG MẠI SẢN XUẤT DỊCH VỤ THẨM MỸ TRƯƠNG KIỀU XUÂN - CHI NHÁNH ĐẮK LẮK,3300400614-003,TRƯƠNG ANH QUYỀN," Số 90B đường Lê Hồng Phong, Lô 17B Khu Tái định cư chợ Buôn Ma Thuột, Phường Thống Nhất, TP.Buôn Ma Thuột, Tỉnh Đắk Lắk, Việt Nam",https://masothue.com/3300400614-003-cong-ty-tnhh-thuong-mai-san-xuat-dich-vu-tham-my-truong-kieu-xuan-chi-nha-nh-da-k-la-k
CÔNG TY TNHH CHÂU THUỶ - CHI NHÁNH YÊN PHONG,0900277526-001,NGUYỄN HUY CHÂU," (NR ông Nguyễn Trường Giang) Thôn Đông Yên, Xã Đông Phong, Huyện Yên Phong, Tỉnh Bắc Ninh, Việt Nam",https://masothue.com/0900277526-001-cong-ty-tnhh-chau-thuy-chi-nhanh-yen-phong
CÔNG TY TNHH MỘT THÀNH VIÊN DỊCH VỤ THƯƠNG MẠI XUẤT NHẬP KHẨU NHẬT HÀ - CƠ SỞ NHẬT HÀ 7,1800586522-010,HUỲNH LONG HÀ," 03, Đại lộ Hòa Bình, Phường Tân An, Quận Ninh Kiều, Thành phố Cần Thơ, Việt Nam",https://masothue.com/1800586522-010-cong-ty-tnhh-mot-thanh-vien-dich-vu-thuong-mai-xuat-nhap-khau-nhat-ha-co-so-nhat-ha-7
CHI NHÁNH DOANH NGHIỆP TƯ NHÂN SONG HỶ,3701404133-001,TÔN NỮ THỊ CÚC," Lô CT 01A- Ô 44, khu dân cư Việt Sing, Phường An Phú, Thành phố Thuận An, Tỉnh Bình Dương, Việt Nam",https://masothue.com/3701404133-001-chi-nhanh-doanh-nghiep-tu-nhan-song-hy
CÔNG TY TRÁCH NHIỆM HỮU HẠN ANH ĐÀO - CƠ SỞ ANH ĐÀO 2,1500455159-010,BÙI NGỌC THẢO," Tổ 10, ấp Đông Bình A, Xã Đông Bình, Thị xã Bình Minh, Tỉnh Vĩnh Long, Việt Nam",https://masothue.com/1500455159-010-cong-ty-trach-nhiem-huu-han-anh-dao-co-so-anh-dao-2
