company_name,mst,company_representative,address,href
CÔNG TY TNHH MỘT THÀNH VIÊN SAKURA SPA,3702421389,NGUYỄN THỊ THANH," C193 The Oasis 1, Đường D33, Khu dân cư Việt Sing, Phường An Phú, Thành phố Thuận An, Tỉnh Bình Dương, Việt Nam",https://masothue.com/3702421389-cong-ty-tnhh-mot-thanh-vien-sakura-spa
CÔNG TY TNHH MTV THƯƠNG MẠI & DỊCH VỤ NAM ANH THƯ,0401754597,NGÔ THỊ QUỲNH NHANG," Lô 22 Võ Văn Kiệt, Phường An Hải Đông, Quận Sơn Trà, Thành phố Đà Nẵng, Việt Nam",https://masothue.com/0401754597-cong-ty-tnhh-mtv-thuong-mai-dich-vu-nam-anh-thu
CÔNG TY CỔ PHẦN VIỆN THẨM MỸ KISA,0314440072,NGUYỄN THỊ TUYỀN," 543/23 Nguyễn Duy Trinh, Phường Bình Trưng Đông, Quận 2, Thành phố Hồ Chí Minh, Việt Nam",https://masothue.com/0314440072-cong-ty-co-phan-vien-tham-my-kisa
CÔNG TY TNHH TRƯƠNG VĨNH LỘC,4600978246,TRƯƠNG VĂN SÁU," Xóm Phú Thịnh, Xã Thuận Thành, Thị xã Phổ Yên, Tỉnh Thái Nguyên, Việt Nam",https://masothue.com/4600978246-cong-ty-tnhh-truong-vinh-loc
CÔNG TY TNHH MỘT THÀNH VIÊN NHẬT NGUYỆT HG,5100445756,LÝ THỊ CHIÊM," Số nhà 15C, đường Nguyễn Trãi, tổ 18, Phường Nguyễn Trãi, Thành Phố Hà Giang, Tỉnh Hà Giang, Việt Nam",https://masothue.com/5100445756-cong-ty-tnhh-mot-thanh-vien-nhat-nguyet-hg
CÔNG TY TNHH DỊCH VỤ CAO CẤP TRƯỜNG HẢI,0106494373,ĐỖ THỊ HẢI," Số nhà 196, phố Vĩnh Hưng, Phường Vĩnh Hưng, Quận Hoàng Mai, Thành phố Hà Nội, Việt Nam",https://masothue.com/0106494373-cong-ty-tnhh-dich-vu-cao-cap-truong-hai
CÔNG TY TNHH MỘT THÀNH VIÊN DỊCH VỤ THƯƠNG MẠI MR LIỆT - CHI NHÁNH QUẢNG TRỊ,2001293017-002,NGUYỄN VĂN LIỆT," Tầng 4, Khách sạn Mường Thanh, Số 68 Lê Duẩn, Khu phố 9, Phường 1, Thành phố Đông Hà, Tỉnh Quảng Trị, Việt Nam",https://masothue.com/2001293017-002-cong-ty-tnhh-mot-thanh-vien-dich-vu-thuong-mai-mr-liet-chi-nhanh-quang-tri
CHI NHÁNH CÔNG TY TNHH MỘT THÀNH VIÊN DỊCH VỤ THƯƠNG MẠI MR LIỆT TẠI QUẢNG BÌNH,2001293017-001,NGUYỄN VĂN LIỆT," Tầng 1, Khách sạn Mường Thanh Quảng Bình, Số 119, Trương Pháp, Phường Hải Thành, Thành phố Đồng Hới, Tỉnh Quảng Bình, Việt Nam",https://masothue.com/2001293017-001-chi-nhanh-cong-ty-tnhh-mot-thanh-vien-dich-vu-thuong-mai-mr-liet-tai-quang-binh
CÔNG TY TNHH THƯƠNG MẠI VÀ DỊCH VỤ VIC PLUS,2300994444,THÂN HOÀNG HÀ," Số nhà 11A, đường Võ Cường 12, khu Hòa Đình, Phường Võ Cường, Thành phố Bắc Ninh, Tỉnh Bắc Ninh, Việt Nam",https://masothue.com/2300994444-cong-ty-tnhh-thuong-ma-i-va-di-ch-vu-vic-plus
CÔNG TY TNHH THẨM MỸ VIỆN ELSA,0108051426,TRẦN THỊ MAI PHƯƠNG," Số 405 đường Nguyễn Khang, Tổ 4, Phường Yên Hoà, Quận Cầu Giấy, Thành phố Hà Nội, Việt Nam",https://masothue.com/0108051426-cong-ty-tnhh-tham-my-vien-elsa
CÔNG TY TNHH THƯƠNG MẠI DỊCH VỤ ĐÀO TẠO NGỌC LAM,0107811314,NGUYỄN HỒNG NGỌC ," Số 99 Mạc Thái Tổ, Phường Yên Hoà, Quận Cầu Giấy, Thành phố Hà Nội, Việt Nam",https://masothue.com/0107811314-cong-ty-tnhh-thuong-mai-dich-vu-dao-tao-ngoc-lam
CÔNG TY CỔ PHẦN THƯƠNG MẠI DỊCH VỤ CHĂM SÓC VÀ LÀM ĐẸP CALLA,0106887039,QUÁCH LINH CHI," Số 10A hẻm 14, ngách 40, ngõ 79 Cầu Giấy, Phường Yên Hoà, Quận Cầu Giấy, Thành phố Hà Nội, Việt Nam",https://masothue.com/0106887039-cong-ty-co-phan-thuong-mai-dich-vu-cham-soc-va-lam-dep-calla
DOANH NGHIỆP TƯ NHÂN DỊCH VỤ SEN SPA,0106471827,NGUYỄN THỊ TUYẾT NGA," Số nhà 27, Ngõ 16 Phố Huỳnh Thúc Kháng, Phường Láng Hạ, Quận Đống Đa, Thành phố Hà Nội, Việt Nam",https://masothue.com/0106471827-doanh-nghiep-tu-nhan-dich-vu-sen-spa
CÔNG TY TNHH THƯƠNG MẠI VÀ DỊCH VỤ DIỆU NGỌC,0107972167,VĂN DIỆU NGỌC," Số 5, ngõ 6, khu Cầu Đơ 5, Phường Hà Cầu, Quận Hà Đông, Thành phố Hà Nội, Việt Nam",https://masothue.com/0107972167-cong-ty-tnhh-thuong-mai-va-dich-vu-dieu-ngoc
CÔNG TY TNHH DỊCH VỤ VÀ PHÁT TRIỂN THƯƠNG MẠI MINH THÀNH,0106676648,TRẦN KIỀU LY," Số 43 Lê Ngọc Hân, Phường Phạm Đình Hổ, Quận Hai Bà Trưng, Thành phố Hà Nội, Việt Nam",https://masothue.com/0106676648-cong-ty-tnhh-dich-vu-va-phat-trien-thuong-mai-minh-thanh
CHI NHÁNH CÔNG TY TNHH ĐẦU TƯ VÀ PHÁT TRIỂN LAM CÚC,0106440811-001,NGUYỄN THỊ KIM CÚC," 60 Sương Nguyệt Ánh, Phường Bến Thành, Quận 1, Thành phố Hồ Chí Minh, Việt Nam",https://masothue.com/0106440811-001-chi-nhanh-cong-ty-tnhh-dau-tu-va-phat-trien-lam-cuc
CÔNG TY TNHH DỊCH VỤ MIDO VIỆT NAM,0107430340,NGÔ VĂN PHONG ," Số 13 Hàng Bè, Phường Hàng Bạc, Quận Hoàn Kiếm, Thành phố Hà Nội, Việt Nam",https://masothue.com/0107430340-cong-ty-tnhh-dich-vu-mido-viet-nam
CÔNG TY TNHH GLOVI HÀ NỘI,0107822764,ĐỖ HẢI VÂN," Kiot 4, Nơ 6B, bán đảo Linh Đàm, đường Nguyễn Duy Trinh, Phường Hoàng Liệt, Quận Hoàng Mai, Thành phố Hà Nội, Việt Nam",https://masothue.com/0107822764-cong-ty-tnhh-glovi-ha-noi
CÔNG TY TNHH MINA HÀ NỘI,0106850374,NGUYỄN THỊ THU HƯƠNG," Số 52 phố Vương Thừa Vũ, Phường Khương Trung, Quận Thanh Xuân, Thành phố Hà Nội, Việt Nam",https://masothue.com/0106850374-cong-ty-tnhh-mina-ha-noi
CÔNG TY CỔ PHẦN BIG HEALTH AND BEAUTY,0107339437,NGUYỄN MẠNH HÀ," Tầng 4, tòa nhà 25T2, khu N05, khu đô thị Đông Nam Trần Duy Hưng, Phường Trung Hoà, Quận Cầu Giấy, Thành phố Hà Nội, Việt Nam",https://masothue.com/0107339437-cong-ty-co-phan-big-health-and-beauty
CÔNG TY TNHH TM DV SPA THIÊN PHÚC,4201670354,HUỲNH VĂN LUÂN," 8/3 Nguyễn Thiện Thuật, Phường Tân Lập, Thành phố Nha Trang, Tỉnh Khánh Hòa, Việt Nam",https://masothue.com/4201670354-cong-ty-tnhh-tm-dv-spa-thien-phuc
CÔNG TY TNHH CHĂM SÓC DA NGỌC ANH SPA,1702122875,NGÔ THỊ LINH XUÂN," Số 14E đường Lý Thường Kiệt, khu phố 5, Thị Trấn Dương Đông, Huyện Phú Quốc, Tỉnh Kiên Giang, Việt Nam",https://masothue.com/1702122875-cong-ty-tnhh-cham-soc-da-ngoc-anh-spa
DOANH NGHIỆP TƯ NHÂN TÚC ĐẠO,5300723094,PHẠM THỊ NGA," Số nhà 015, Phố Nguyễn Thị Định, Phường Bắc Cường, Thành phố Lào Cai, Tỉnh Lào Cai, Việt Nam",https://masothue.com/5300723094-doanh-nghiep-tu-nhan-tuc-dao
CÔNG TY TNHH PAMAS VIỆT TRÌ,2600987046,HÀ THỊ SOẠN," Khu đô thị và nhà ở Tân Dân, Phường Tân Dân, Thành phố Việt Trì, Tỉnh Phú Thọ, Việt Nam",https://masothue.com/2600987046-cong-ty-tnhh-pamas-viet-tri
DOANH NGHIỆP TƯ NHÂN ÁNH SÁNG KHIẾM THỊ,4401034902,HUỲNH CÔNG HẠNH," Số 229 Lê Trung Kiên, Phường 2, TP Tuy Hoà, Tỉnh Phú Yên, Việt Nam",https://masothue.com/4401034902-doanh-nghiep-tu-nhan-anh-sang-khiem-thi
CÔNG TY TNHH MỘT THÀNH VIÊN ONE ONE HỘI AN,4001127408,LÊ VIẾT GIANG," 56 Phan Đăng Lưu, Phường Tân An, Thành phố Hội An, Tỉnh Quảng Nam, Việt Nam",https://masothue.com/4001127408-cong-ty-tnhh-mot-thanh-vien-one-one-hoi-an
CÔNG TY TNHH MTV LALY,5701809870,CHU THẾ MẠNH," SN 52, đường Cao Thắng, Phường Trần Hưng Đạo, Thành phố Hạ Long, Tỉnh Quảng Ninh, Việt Nam",https://masothue.com/5701809870-cong-ty-tnhh-mtv-laly
DOANH NGHIỆP TƯ NHÂN LÀM ĐẸP PHƯƠNG LIÊN,5701706201,ĐÀO THỊ KIM LIÊN," SN 36, tổ 20, khu 3, Phường Trưng Vương, Thành phố Uông Bí, Tỉnh Quảng Ninh, Việt Nam",https://masothue.com/5701706201-doanh-nghiep-tu-nhan-lam-dep-phuong-lien
CÔNG TY TNHH HOA ĐỆ NHẤT TẤN PHÁT,3901241006,PHẠM THỊ HOA," Tổ 3, ấp An Bình, Xã An Tịnh, Thị xã Trảng Bàng, Tỉnh Tây Ninh, Việt Nam",https://masothue.com/3901241006-cong-ty-tnhh-hoa-de-nhat-tan-phat
DOANH NGHIỆP TƯ NHÂN HOA ĐIỆT,1001104250,BÙI THỊ HOA," Số nhà 01, ngõ 209, đường Trần Thái Tông, tổ 24, Phường Trần Hưng Đạo, Thành phố Thái Bình, Tỉnh Thái Bình, Việt Nam",https://masothue.com/1001104250-doanh-nghiep-tu-nhan-hoa-diet
CÔNG TY TNHH DỊCH VỤ THƯƠNG MẠI LỘC PHÁT TH,2802553901,LÂM MỘNG CẦM," Tầng 2, Khách sạn Lam Kinh, Đại lộ Lê Lợi, Khu đô thị mới Đông Hương, Phường Đông Hương, Thành phố Thanh Hoá, Tỉnh Thanh Hoá, Việt Nam",https://masothue.com/2802553901-cong-ty-tnhh-dich-vu-thuong-mai-loc-phat-th
CHI NHÁNH CÔNG TY CỔ PHẦN TẬP ĐOÀN KHƠ THỊ,0313496361-001,NGUYỄN THỊ THU HOÀI," 49I - 49H Phan Đăng Lưu, Phường 07, Quận Phú Nhuận, Thành phố Hồ Chí Minh, Việt Nam",https://masothue.com/0313496361-001-chi-nhanh-cong-ty-co-phan-tap-doan-kho-thi
CÔNG TY TNHH PHÁT TRIỂN THƯƠNG MẠI DỊCH VỤ DU LỊCH FAMILY,0314317618,TRẦN DIỆU LINH," 37 Đường Nội Khu Hưng Gia 4, Khu Phố 3, Phường Tân Phong, Quận 7, Thành phố Hồ Chí Minh, Việt Nam",https://masothue.com/0314317618-cong-ty-tnhh-phat-trien-thuong-mai-dich-vu-du-lich-family
DOANH NGHIỆP TN XÔNG HƠI - XOA BÓP THANH VŨ 1,1801288247,LÊ VĂN ÚT," 2/100, Lê Lai, Phường An Phú, Quận Ninh Kiều, Thành phố Cần Thơ, Việt Nam",https://masothue.com/1801288247-doanh-nghiep-tn-xong-hoi-xoa-bop-thanh-vu-1
DOANH NGHIỆP TN MẠ NON,2001169203,TÔ VĂN AN," Số 426, đường Trần Văn Thời, khóm 3, Phường 6, Thành phố Cà Mau, Tỉnh Cà Mau, Việt Nam",https://masothue.com/2001169203-doanh-nghiep-tn-ma-non
DOANH NGHIỆP TN THƯỢNG HẢI,2000505727,LÊ THỊ LỆ," Số 158, đường Nguyễn Tất Thành, khóm 1, Phường 8, Thành phố Cà Mau, Tỉnh Cà Mau, Việt Nam",https://masothue.com/2000505727-doanh-nghiep-tn-thuong-hai
DOANH NGHIỆP TN NGỌC HIẾU,2000476219,PHẠM VĂN SỸ," Số 158A, đường Nguyễn Tất Thành, khóm 1, Phường 8, Thành phố Cà Mau, Tỉnh Cà Mau, Việt Nam",https://masothue.com/2000476219-doanh-nghiep-tn-ngoc-hieu
DOANH NGHIỆP TƯ NHÂN THƯƠNG MẠI DỊCH VỤ NGỌC TUYẾN,1801333771,PHAN VĂN ĐẠT," 5/10, Lê Hồng Phong, KVII, Phường Bình Thủy, Quận Bình Thuỷ, Thành phố Cần Thơ, Việt Nam",https://masothue.com/1801333771-doanh-nghiep-tu-nhan-thuong-mai-dich-vu-ngoc-tuyen
CÔNG TY TNHH ĐẦU TƯ THƯƠNG MẠI VÀ DỊCH VỤ MỘC KỲ NAM,0401861662,PHẠM HỮU QUYỀN," 20 Đống Đa, Phường Thuận Phước, Quận Hải Châu, Thành phố Đà Nẵng, Việt Nam",https://masothue.com/0401861662-cong-ty-tnhh-dau-tu-thuong-mai-va-dich-vu-moc-ky-nam
CÔNG TY TNHH MTV PHÁT TRIỂN DỊCH VỤ SONG HAN VINA,0401732642,NGUYỄN THỊ THÙY LIÊN," 11 Hoàng Văn Thụ, Phường Phước Ninh, Quận Hải Châu, Thành phố Đà Nẵng, Việt Nam",https://masothue.com/0401732642-cong-ty-tnhh-mtv-phat-trien-dich-vu-song-han-vina
CÔNG TY TNHH MỘT THÀNH VIÊN DỊCH VỤ WATER CUBE,0401706145,NGUYỄN VĂN LÂM," Số 5 Cách Mạng Tháng 8, Phường Hoà Cường Nam, Quận Hải Châu, Thành phố Đà Nẵng, Việt Nam",https://masothue.com/0401706145-cong-ty-tnhh-mot-thanh-vien-dich-vu-water-cube
DOANH NGHIỆP TƯ NHÂN IVY SPA,0401537521,HỒ LÊ THỊ THẢO UYÊN," 168 Lê Đình Dương, Phường Hải Châu Ii, Quận Hải Châu, Thành phố Đà Nẵng, Việt Nam",https://masothue.com/0401537521-doanh-nghiep-tu-nhan-ivy-spa
CHI NHÁNH CÔNG TY TNHH MTV CHANGMIN VIỆT NAM TẠI BIÊN HÒA,0401767892-002,NGUYỄN VIỆT ANH," Số D16, Khu dân cư thương mại Vĩnh Tường, KP 2, Phường Tân Mai, Thành phố Biên Hoà, Tỉnh Đồng Nai, Việt Nam",https://masothue.com/0401767892-002-chi-nhanh-cong-ty-tnhh-mtv-changmin-viet-nam-tai-bien-hoa
CHI NHÁNH CÔNG TY TNHH MỘT THÀNH VIÊN BEACH PARADISE,0401676620-001,NGUYỄN NGỌC THU HÀ," 46 Hà Bổng, Phường Phước Mỹ, Quận Sơn Trà, Thành phố Đà Nẵng, Việt Nam",https://masothue.com/0401676620-001-chi-nhanh-cong-ty-tnhh-mot-thanh-vien-beach-paradise
CÔNG TY TNHH MỘT THÀNH VIÊN PHÚC LỘC HIẾU,0401542698,NGÔ MINH HIẾU," 130 Điện Biên Phủ, Phường Chính Gián, Quận Thanh Khê, Thành phố Đà Nẵng, Việt Nam",https://masothue.com/0401542698-cong-ty-tnhh-mot-thanh-vien-phuc-loc-hieu
DOANH NGHIỆP TƯ NHÂN MASSAGE 3G,6001553537,NGUYỄN THỊ TUYẾT," Số 102 đường Mai Hắc Đế, Phường Tân Thành, TP.Buôn Ma Thuột, Tỉnh Đắk Lắk, Việt Nam",https://masothue.com/6001553537-doanh-nghiep-tu-nhan-massage-3g
CÔNG TY TNHH DỊCH VỤ MASSAGE MINH VY,6001310213,LÊ XUÂN PHƯỚC," Số 169 đường Trần Hưng Đạo, Phường An Lạc, Thị xã Buôn Hồ, Tỉnh Đắk Lắk, Việt Nam",https://masothue.com/6001310213-cong-ty-tnhh-dich-vu-massage-minh-vy
CÔNG TY TNHH MASSAGE PHƯỚC AN AN,3603525612,VÕ THANH HẢI," Số F125, KP 7, Phường Thống Nhất, Thành phố Biên Hoà, Tỉnh Đồng Nai, Việt Nam",https://masothue.com/3603525612-cong-ty-tnhh-massage-phuoc-an-an
DOANH NGHIỆP TƯ NHÂN CHĂM SÓC SẮC ĐẸP PHƯỢNG HOÀNG,3603314957,DƯƠNG THỊ PHƯỢNG," Số 2057, Nguyễn Ái Quốc, KP 3, Phường Trung Dũng, Thành phố Biên Hoà, Tỉnh Đồng Nai, Việt Nam",https://masothue.com/3603314957-doanh-nghiep-tu-nhan-cham-soc-sac-dep-phuong-hoang
CÔNG TY TNHH THƯƠNG MẠI ĐÔN PHƯƠNG,0700643574,HOÀNG VĂN ĐÔN," Ngã tư Thanh Liêm , Xã Thanh Hà, Huyện Thanh Liêm, Tỉnh Hà Nam, Việt Nam",https://masothue.com/0700643574-cong-ty-tnhh-thuong-mai-don-phuong
CÔNG TY TNHH VẬT LÝ TRỊ LIỆU TOÀN THẮNG,0108320566,NGUYỄN THẮNG," Thôn Hậu Ái, Xã Vân Canh, Huyện Hoài Đức, Thành phố Hà Nội, Việt Nam",https://masothue.com/0108320566-cong-ty-tnhh-vat-ly-tri-lieu-toan-thang
CÔNG TY TNHH DỊCH VỤ CHĂM SÓC SỨC KHỎE HT,0107655640,PHAN THỊ HIẾU," Xóm 4, khu 1, Xã Phượng Cách, Huyện Quốc Oai, Thành phố Hà Nội, Việt Nam",https://masothue.com/0107655640-cong-ty-tnhh-dich-vu-cham-soc-suc-khoe-ht
CÔNG TY TNHH CHĂM SÓC GIA ĐÌNH HẰNG NGA,0106628154,CHU QUANG TUYẾN," Số 30, ngõ 31 Nguyễn Chí Thanh, Phường Ngọc Khánh, Quận Ba Đình, Thành phố Hà Nội, Việt Nam",https://masothue.com/0106628154-cong-ty-tnhh-cham-soc-gia-dinh-hang-nga
CÔNG TY CỔ PHẦN ĐÀO TẠO VÀ DỊCH VỤ TINA ĐỖ,0106952898,ĐỖ THỊ LAN PHƯƠNG," Số nhà 10A, ngách 14, ngõ 376, đường Bưởi, Phường Vĩnh Phúc, Quận Ba Đình, Thành phố Hà Nội, Việt Nam",https://masothue.com/0106952898-cong-ty-co-phan-dao-tao-va-dich-vu-tina-do
CÔNG TY TNHH HELEN BEAUTY VIỆT NAM,0107542774,NGUYỄN THỊ HUYÊN," số 12, ngõ 180 đường Hoàng Quốc Việt, Phường Cổ Nhuế 1, Quận Bắc Từ Liêm, Thành phố Hà Nội, Việt Nam",https://masothue.com/0107542774-cong-ty-tnhh-helen-beauty-viet-nam
CÔNG TY CỔ PHẦN ĐẦU TƯ VÀ DỊCH VỤ GIA VIỆT,0106761702,NGUYỄN LƯƠNG HIỀN," Số 5 Lô A3, ngõ 118 Nguyễn Khánh Toàn, Phường Quan Hoa, Quận Cầu Giấy, Thành phố Hà Nội, Việt Nam",https://masothue.com/0106761702-cong-ty-co-phan-dau-tu-va-dich-vu-gia-viet
CÔNG TY TRÁCH NHIỆM HỮU HẠN MTV 24H BEAUTY ACADEMY,0107798430,NGUYỄN THANH QUÝ," Số 69 ngõ 172 đường Phú Diễn, Phường Phú Diễn, Quận Bắc Từ Liêm, Thành phố Hà Nội, Việt Nam",https://masothue.com/0107798430-cong-ty-trach-nhiem-huu-han-mtv-24h-beauty-academy
CHI NHÁNH CÔNG TY TNHH HÙNG YẾN NGUYỄN TẠI HÀ NỘI,0106814111-001,NGUYỄN THỊ YẾN," C20 Trung Kính - Khu tập thể Học viện hành chính Quốc gia, Phường Yên Hoà, Quận Cầu Giấy, Thành phố Hà Nội, Việt Nam",https://masothue.com/0106814111-001-chi-nhanh-cong-ty-tnhh-hung-yen-nguyen-tai-ha-noi
CÔNG TY TNHH HÙNG YẾN NGUYỄN,0106814111,NGUYỄN THỊ YẾN," Số 95B, phố Trung Kính , Phường Trung Hoà, Quận Cầu Giấy, Thành phố Hà Nội, Việt Nam",https://masothue.com/0106814111-cong-ty-tnhh-hung-yen-nguyen
CÔNG TY CỔ PHẦN DANA BEAUTY,0401872304,DƯƠNG THỊ NGOAN," 455 Trần Hưng Đạo, Phường An Hải Tây, Quận Sơn Trà, Thành phố Đà Nẵng, Việt Nam",https://masothue.com/0401872304-cong-ty-co-phan-dana-beauty
CÔNG TY TNHH THẨM MỸ VIỆN A HOÀNH NINH THUẬN,4500614968,NGUYỄN ĐÌNH HOÀNH," Số 18 Lý Thường Kiệt, Phường Kinh Dinh, TP. Phan Rang-Tháp Chàm, Tỉnh Ninh Thuận, Việt Nam",https://masothue.com/4500614968-cong-ty-tnhh-tham-my-vien-a-hoanh-ninh-thuan
CÔNG TY CỔ PHẦN ĐẦU TƯ VÀ PHÁT TRIỂN GM,0108092461,ĐẶNG NGUYỄN THU NGÂN," N.14B – số 111, ngõ 84, phố Trần Quang Diệu, Phường Ô Chợ Dừa, Quận Đống Đa, Thành phố Hà Nội, Việt Nam",https://masothue.com/0108092461-cong-ty-co-phan-dau-tu-va-phat-trien-gm
CÔNG TY TNHH THƯƠNG MẠI SẢN XUẤT DỊCH VỤ THẨM MỸ TRƯƠNG KIỀU XUÂN CHI NHÁNH THANH HÓA,3300400614-004,NGUYỄN THỊ HUYỀN," Số 197, đường Lê Hoàn, Phường Lam Sơn, Thành phố Thanh Hoá, Tỉnh Thanh Hoá, Việt Nam",https://masothue.com/3300400614-004-cong-ty-tnhh-thuong-mai-san-xuat-dich-vu-tham-my-truong-kieu-xuan-chi-nhanh-thanh-hoa
CÔNG TY TNHH DỊCH VỤ SỨC KHỎE ĐẠI DƯƠNG MỚI,0107868409,LÊ VĂN NAM," BT1, lô 1, khu đô thị Mễ Trì Hạ, Phường Mễ Trì, Quận Nam Từ Liêm, Thành phố Hà Nội, Việt Nam",https://masothue.com/0107868409-cong-ty-tnhh-dich-vu-suc-khoe-dai-duong-moi
CÔNG TY TNHH MTV PERFECT DREAM,0401816099,MAI THỊ THU TRÚC," 101A Hồ Xuân Hương, Phường Mỹ An, Quận Ngũ Hành Sơn, Thành phố Đà Nẵng, Việt Nam",https://masothue.com/0401816099-cong-ty-tnhh-mtv-perfect-dream
CÔNG TY TNHH L.PARADIS BẾN TRE,1301057474,ĐẬU VĂN THÌN," 112/1B, khu phố 2, Thị Trấn Bình Đại, Huyện Bình Đại, Tỉnh Bến Tre, Việt Nam",https://masothue.com/1301057474-cong-ty-tnhh-l-paradis-ben-tre
CÔNG TY TNHH THƯƠNG MẠI DU LỊCH HOÀI ANH,3401131206,NGUYỄN BÌNH ĐỊNH," 16A Huỳnh Thúc Kháng , Phường Hàm Tiến, Thành phố Phan Thiết, Tỉnh Bình Thuận, Việt Nam",https://masothue.com/3401131206-cong-ty-tnhh-thuong-mai-du-lich-hoai-anh
CHI NHÁNH 4 MASSAGE THANH TIỀN I - DOANH NGHIỆP TN LÊ THANH TIỀN,2000424242-004,HỒ PHƯỚC HÒA," 176, Ngô Quyền, Phường 1, Thành phố Cà Mau, Tỉnh Cà Mau, Việt Nam",https://masothue.com/2000424242-004-chi-nhanh-4-massage-thanh-tien-i-doanh-nghiep-tn-le-thanh-tien
CHI NHÁNH DNTN SÔNG HƯƠNG III - MASSAGE NEW,2000436086-002,NGUYỄN VĂN CƯỜNG," Số 297, đường Lý Thường Kiệt, khóm 2, Phường 6, Thành phố Cà Mau, Tỉnh Cà Mau, Việt Nam",https://masothue.com/2000436086-002-chi-nhanh-dntn-song-huong-iii-massage-new
CÔNG TY TNHH CHĂM SÓC SẮC ĐẸP MAI CHI,4001123308,NGUYỄN THỊ HẠNH CHI ," Lô R08-21 Đường Phan Thúc Duyện, Phường Vĩnh Điện, Thị xã Điện Bàn, Tỉnh Quảng Nam, Việt Nam",https://masothue.com/4001123308-cong-ty-tnhh-cham-soc-sac-dep-mai-chi
CÔNG TY TNHH THƯƠNG MẠI DỊCH VỤ IF,0314660776,NGUYỄN ANH TUẤN," 109 Nguyễn Hồng Đào, Phường 14, Quận Tân Bình, Thành phố Hồ Chí Minh, Việt Nam",https://masothue.com/0314660776-cong-ty-tnhh-thuong-mai-dich-vu-if
DOANH NGHIỆP TƯ NHÂN NẮNG MÂY HỒNG,3702431789,NGUYỄN THỊ THỚI," Số 11/19, khu phố Bình Phước B, Phường Bình Chuẩn, Thành phố Thuận An, Tỉnh Bình Dương, Việt Nam",https://masothue.com/3702431789-doanh-nghiep-tu-nhan-nang-may-hong
CÔNG TY TNHH MỘT THÀNH VIÊN ANH PHƯƠNG DUY,1801607969,NGUYỄN THỊ NGỌC HỒ," MG1-01, Vincom Xuân Khánh, số 209 đường 30/4, Phường Xuân Khánh, Quận Ninh Kiều, Thành phố Cần Thơ, Việt Nam",https://masothue.com/1801607969-cong-ty-tnhh-mot-thanh-vien-anh-phuong-duy
CÔNG TY TNHH MỸ VIỆN SARA SKY QUỐC TẾ,0108279702,NGUYỄN THỊ HƯƠNG THÙY," Thôn 2, Xã Song Phương, Huyện Hoài Đức, Thành phố Hà Nội, Việt Nam",https://masothue.com/0108279702-cong-ty-tnhh-my-vien-sara-sky-quoc-te
CÔNG TY TNHH THẨM MỸ SPA KHÁNH PHƯƠNG,0107528988,NGUYỄN THỊ PHƯƠNG," Số 213 Đường Trần Quốc Hoàn, Phường Dịch Vọng Hậu, Quận Cầu Giấy, Thành phố Hà Nội, Việt Nam",https://masothue.com/0107528988-cong-ty-tnhh-tham-my-spa-khanh-phuong
CÔNG TY TNHH 1380 TOTAL BEAUTY,0108536212,VŨ THỊ TUYẾT ," Số 94 Trung Hòa, Phường Trung Hoà, Quận Cầu Giấy, Thành phố Hà Nội, Việt Nam",https://masothue.com/0108536212-cong-ty-tnhh-1380-total-beauty
CÔNG TY CỔ PHẦN CHĂM SÓC SỨC KHỎE VÀ SẮC ĐẸP TRẦN GIA,0107838524,TRẦN BẢO LONG," Số 11 tổ 33, phố Trung Kính, Phường Trung Hoà, Quận Cầu Giấy, Thành phố Hà Nội, Việt Nam",https://masothue.com/0107838524-cong-ty-co-phan-cham-soc-suc-khoe-va-sac-dep-tran-gia
CÔNG TY TNHH IRIS BEAUTY VIỆT NAM,0107537830,LÊ THỊ DUNG," Lô 3, liền kề 4, Khu Đô thị Văn Khê, Phường La Khê, Quận Hà Đông, Thành phố Hà Nội, Việt Nam",https://masothue.com/0107537830-cong-ty-tnhh-iris-beauty-viet-nam
CÔNG TY TNHH DỊCH VỤ VÀ PHÁT TRIỂN THƯƠNG MẠI LÂM GIA,0108364796,NGUYỄN TÙNG LINH ," Số 120 phố Bùi Thị Xuân, Phường Bùi Thị Xuân, Quận Hai Bà Trưng, Thành phố Hà Nội, Việt Nam",https://masothue.com/0108364796-cong-ty-tnhh-dich-vu-va-phat-trien-thuong-mai-lam-gia
CÔNG TY TNHH ĐẦU TƯ PHÁT TRIỂN VÀ DỊCH VỤ TUỆ ANH,0108255317,NGUYỄN HOÀNG ANH ," Số 79 Phố Mai Hắc Đế, Phường Bùi Thị Xuân, Quận Hai Bà Trưng, Thành phố Hà Nội, Việt Nam",https://masothue.com/0108255317-cong-ty-tnhh-dau-tu-phat-trien-va-dich-vu-tue-anh
CÔNG TY TNHH THƯƠNG MẠI VẺ ĐẸP VIỆT,0107472132,HỮU THỊ NGUYỆT," Số 38B, Triệu Việt Vương, Phường Bùi Thị Xuân, Quận Hai Bà Trưng, Thành phố Hà Nội, Việt Nam",https://masothue.com/0107472132-cong-ty-tnhh-thuong-mai-ve-dep-viet
CÔNG TY TNHH TOÀN CẦU R & M,0106191795,TRẦN THỊ THANH XUÂN," Số 29 Lý Quốc Sư, Phường Hàng Trống, Quận Hoàn Kiếm, Thành phố Hà Nội, Việt Nam",https://masothue.com/0106191795-cong-ty-tnhh-toan-cau-r-m
CÔNG TY CỔ PHẦN THƯƠNG MẠI VÀ DỊCH VỤ SKINLAB VIỆT NAM,0108025024,HỒNG NGỌC YẾNLÊ THỊ HUYỀN," Số 291 đường Ngọc Lâm, Phường Ngọc Lâm, Quận Long Biên, Thành phố Hà Nội, Việt Nam",https://masothue.com/0108025024-cong-ty-co-phan-thuong-mai-va-dich-vu-skinlab-viet-nam
CÔNG TY TNHH ĐÁ MUỐI NGHỆ THUẬT NGỌC NHUNG,0107395551,VŨ HỒNG NHUNG," Số 296 đường Nghi Tàm, Phường Yên Phụ, Quận Tây Hồ, Thành phố Hà Nội, Việt Nam",https://masothue.com/0107395551-cong-ty-tnhh-da-muoi-nghe-thuat-ngoc-nhung
CHI NHÁNH DOANH NGHIỆP TƯ NHÂN SÔNG HƯƠNG,1101266865-001,BÙI QUYÊN QUYÊN," Ấp 1, Xã Vĩnh Bình, Huyện Vĩnh Hưng, Tỉnh Long An, Việt Nam",https://masothue.com/1101266865-001-chi-nhanh-doanh-nghiep-tu-nhan-song-huong
DOANH NGHIỆP TƯ NHÂN SÔNG HƯƠNG,1101266865,BÙI QUYÊN QUYÊN," Ấp Hội Xuân, Thị Trấn Tầm Vu, Huyện Châu Thành, Tỉnh Long An, Việt Nam",https://masothue.com/1101266865-doanh-nghiep-tu-nhan-song-huong
TRUNG TÂM THẨM MỸ SPRING TIME - CHI NHÁNH CÔNG TY CỔ PHẦN ĐẦU TƯ LOGICA VIỆT NAM,0105276799-001,TRẦN HỒNG ANH," Số 45C Hàng Bún, Phường Nguyễn Trung Trực, Quận Ba Đình, Thành phố Hà Nội, Việt Nam",https://masothue.com/0105276799-001-trung-tam-tham-my-spring-time-chi-nhanh-cong-ty-co-phan-dau-tu-logica-viet-nam
DOANH NGHIỆP TƯ NHÂN HƯƠNG SEN,1200964606,TRẦN THỊ BÍCH TRÂM," Quốc lộ 1A, Phường 4, Thị Xã Cai Lậy, Tỉnh Tiền Giang, Việt Nam",https://masothue.com/1200964606-doanh-nghiep-tu-nhan-huong-sen
DOANH NGHIỆP TƯ NHÂN THƯƠNG MẠI DỊCH VỤ TỔNG HỢP SƠN THẢO,0105795145,LÊ HỒNG SƠN," Thôn Cao Trung, Xã Đức Giang, Huyện Hoài Đức, Thành phố Hà Nội, Việt Nam",https://masothue.com/0105795145-doanh-nghiep-tu-nhan-thuong-mai-dich-vu-tong-hop-son-thao
CÔNG TY TNHH THƯƠNG MẠI & ĐẦU TƯ HƯNG THỊNH PHÁT,4201258239,CAO DUY TRUYỀN," 24 Nguyễn Thiện Thuật, Phường Tân Lập, Thành phố Nha Trang, Tỉnh Khánh Hòa, Việt Nam",https://masothue.com/4201258239-cong-ty-tnhh-thuong-mai-dau-tu-hung-thinh-phat
DOANH NGHIỆP TƯ NHÂN XUÂN THU NHƠN TRẠCH,3600726039,NGUYỄN THỊ KIỀU XUÂN," Ấp Bến Cam, Xã Phước Thiền, Huyện Nhơn Trạch, Tỉnh Đồng Nai, Việt Nam",https://masothue.com/3600726039-doanh-nghiep-tu-nhan-xuan-thu-nhon-trach
DOANH NGHIỆP TN MASSAGE THIÊN BÌNH,1401373480,HUỲNH THỊ KIM SO," Số 395, Trần Hưng Đạo, khóm 3, Phường 1, Thành phố Sa Đéc, Tỉnh Đồng Tháp, Việt Nam",https://masothue.com/1401373480-doanh-nghiep-tn-massage-thien-binh
CHI NHÁNH CÔNG TY TNHH LỘC TÔ CHÂU,1801002385-006,TRƯƠNG VĂN HOÀNG," Số 358B/25 ấp Phước Ngươn A, Xã Phước Hậu, Huyện Long Hồ, Tỉnh Vĩnh Long, Việt Nam",https://masothue.com/1801002385-006-chi-nhanh-cong-ty-tnhh-loc-to-chau
DOANH NGHIỆP TƯ NHÂN KHẢI HOÀN TG,1201230478,VÕ THANH TUYỀN," Ấp Tân Phong, Xã Tân Lý Tây, Huyện Châu Thành, Tỉnh Tiền Giang, Việt Nam",https://masothue.com/1201230478-doanh-nghiep-tu-nhan-khai-hoan-tg
