co_quan,ky_hieu,loai_hinh,loai_truong,ten_tienganh,ten_truong,tinh,website
Bộ Xây dựng,MTU,Trường đại học,Công lập,Mien Tay Construction University,TRƯỜNG ĐẠI HỌC XÂY DỰNG MIỀN TÂY,Vĩnh Long,http://www.mtu.edu.vn/
Bộ Y tế,YCT,Trường đại học,Công lập,Can Tho University of Medicine - Pharmacy,TRƯỜNG ĐẠI HỌC Y DƯỢC CẦN THƠ,Cần Thơ,http://www.ctump.edu.vn/
Bộ Giáo dục và Đào tạo,DDB,Trường đại học,Tư thục,Thanh Dong University,TRƯỜNG ĐẠI HỌC THÀNH ĐÔNG,Hải Dương,https://thanhdong.edu.vn/
Bộ Giáo dục và Đào tạo,DTL,Trường đại học,Tư thục,Thang Long University,TRƯỜNG ĐẠI HỌC THĂNG LONG,Hà Nội,https://thanglong.edu.vn/
Bộ Y tế,YTB,Trường đại học,Công lập,Thai Binh Medical University,TRƯỜNG ĐẠI HỌC Y DƯỢC THÁI BÌNH,Thái Bình,http://tbump.edu.vn/
Bộ Y tế,YHB,Trường đại học,Công lập,Hanoi Medical University,TRƯỜNG ĐẠI HỌC Y HÀ NỘI,Hà Nội,https://hmu.edu.vn/
Bộ Giáo dục và Đào tạo,DHY,Trường đại học,Công lập,"University of Medicine and Pharmacy, Hue University","TRƯỜNG ĐẠI HỌC Y DƯỢC, ĐẠI HỌC HUẾ",Thừa Thiên Huế,https://huemed-univ.edu.vn/
Bộ Y tế,YPB,Trường đại học,Công lập,Hai Phong Medical University,TRƯỜNG ĐẠI HỌC Y DƯỢC HẢI PHÒNG,Hải Phòng,http://hpmu.edu.vn/hpmu/
UBND TP. Hồ Chí Minh,TYS,Trường đại học,Công lập,Pham Ngoc Thach University of Medicine,TRƯỜNG ĐẠI HỌC Y KHOA PHẠM NGỌC THẠCH,TP. Hồ Chí Minh,https://www.pnt.edu.vn/
Bộ Giáo dục và Đào tạo,DTY,Trường đại học,Công lập,University of Medicine and Pharmacy - Thai Nguyen University,"TRƯỜNG ĐẠI HỌC Y DƯỢC, ĐẠI HỌC THÁI NGUYÊN",Thái Nguyên,http://tump.edu.vn/
Nước ngoài,THU,Trường đại học,Nước ngoài,Tokyo Human Health Sciences University Vietnam,TRƯỜNG ĐẠI HỌC Y KHOA TOKYO VIỆT NAM,Hưng Yên,https://tokyo-human.edu.vn/
UBND tỉnh Nghệ An,YKV,Trường đại học,Công lập,Vinh Medical University,TRƯỜNG ĐẠI HỌC Y KHOA VINH,Nghệ An,http://www.vmu.edu.vn/
Bộ Giáo dục và Đào tạo,DYD,Trường đại học,Tư thục,Yersin University,TRƯỜNG ĐẠI HỌC YERSIN ĐÀ LẠT,Lâm Đồng,https://yersin.edu.vn/
Bộ Giáo dục và Đào tạo,DDQ,Trường đại học,Công lập,University of Economics - The University of Da Nang,"TRƯỜNG ĐẠI HỌC KINH TẾ, ĐẠI HỌC ĐÀ NẴNG",Đà Nẵng,https://due.udn.vn
Bộ Y tế,YTC,Trường đại học,Công lập,Hanoi University of Public Health,TRƯỜNG ĐẠI HỌC Y TẾ CÔNG CỘNG,Hà Nội,https://huph.edu.vn/
Bộ Giáo dục và Đào tạo,DDF,Trường đại học,Công lập,University of Foreign Language Studies - The University of Da Nang,"TRƯỜNG ĐẠI HỌC NGOẠI NGỮ, ĐẠI HỌC ĐÀ NẴNG",Đà Nẵng,http://ufl.udn.vn/
Bộ Giáo dục và Đào tạo,DDC,Trường đại học,Công lập,University of Technology and Education - The University of Da Nang,"TRƯỜNG ĐẠI HỌC SƯ PHẠM KỸ THUẬT, ĐẠI HỌC ĐÀ NẴNG",Đà Nẵng,https://ute.udn.vn/
Bộ Công Thương,V08,Viện nghiên cứu,Công lập,Food Industry Research Institute,Viện Công nghiệp thực phẩm,Hà Nội,https://firi.vn/
Bộ Nông nghiệp và Phát triển nông thôn,VCD,Viện nghiên cứu,Công lập,Vietnam Institute Of Agricultural Engineering And Post-Harvest Technology,Viện Cơ điện Nông nghiệp và Công nghệ sau thu hoạch,Hà Nội,http://www.viaep.org.vn/
Bộ Nông nghiệp và Phát triển nông thôn,VCN,Viện nghiên cứu,Công lập,National Institute of Animal Sciences,Viện Chăn nuôi,Hà Nội,http://vcn.mard.gov.vn/
Tập đoàn Dầu khí Quốc gia Việt Nam,VDK,Viện nghiên cứu,Công lập,Vietnam Petroleum Institute - VPI,Viện Dầu khí Việt Nam,Hà Nội,http://www.vpi.pvn.vn/
Bộ Kế hoạch và Đầu tư,V19,Viện nghiên cứu,Công lập,Vietnam Institute for Development Strategies,Viện Chiến lược phát triển,Hà Nội,http://vids.mpi.gov.vn/
Bộ Y tế,V66,Viện nghiên cứu,Công lập,National Institute of Nutrition,Viện Dinh dưỡng,Hà Nội,http://viendinhduong.vn/
Bộ Y tế,V22,Viện nghiên cứu,Công lập,National Institute of Medical Materials,Viện Dược liệu,Hà Nội,http://vienduoclieu.org.vn/
Bộ Công Thương,V11,Viện nghiên cứu,Công lập,Vietnam Institute of Industry Chemistry,Viện Hoá học công nghiệp,Hà Nội,http://viic.vn/
Bộ Y tế,NQC,Viện nghiên cứu,Công lập,National Institute of Drug Quality Control,Viện Kiểm nghiệm thuốc Trung ương,Hà Nội,https://nidqc.gov.vn/
Bộ Xây dựng,V12,Viện nghiên cứu,Công lập,Vietnam Institute of Architecture,Viện Kiến trúc Quốc gia,Hà Nội,http://vienkientrucquocgia.gov.vn/
Bộ Xây dựng,V14,Viện nghiên cứu,Công lập,Vietnam Institute for Building Science and Technology,Viện Khoa học công nghệ xây dựng,Hà Nội,http://www.ibst.vn/
Bộ Giáo dục và Đào tạo,V46,Viện nghiên cứu,Công lập,The Vietnam National Institute of Education Sciences,Viện Khoa học Giáo dục Việt nam,Hà Nội,http://www.vnies.edu.vn/
Bộ Tài nguyên và Môi trường,V47,Viện nghiên cứu,Công lập,Vietnam Institute of Geosciences and Mineral Resources,Viện Khoa học Địa chất và Khoáng sản,Hà Nội,https://vigmr.vn
Bộ Tài nguyên và Môi trường,V50,Viện nghiên cứu,Công lập,"Vietnam Institute of Meteorology, Hydrology and Climate Change",Viện Khoa học Khí tượng Thủy văn và Biến đổi khí hậu,Hà Nội,http://www.imh.ac.vn/
Bộ Tài nguyên và Môi trường,KBD,Viện nghiên cứu,Công lập,Vietnam Institute of Geodesy and Cartography,Viện Khoa học Đo đạc và Bản đồ,Hà Nội,http://www.vigac.vn/
Bộ Nông nghiệp và Phát triển nông thôn,VLN,Viện nghiên cứu,Công lập,Vietnamese Academy of Forest Sciences,Viện Khoa học Lâm nghiệp Việt Nam,Hà Nội,http://vafs.gov.vn/
"Bộ Văn hóa, Thể thao và Du lịch",VKT,Viện nghiên cứu,Công lập,Vietnam Sport Science Institute,Viện Khoa học Thể dục thể thao,Hà Nội,http://vkhtdtt.vn/
Bộ Nông nghiệp và Phát triển nông thôn,VTL,Viện nghiên cứu,Công lập,Vietnam Academy for Water Resources,Viện Khoa học Thuỷ lợi Việt Nam,Hà Nội,http://www.vawr.org.vn/
Bộ Công Thương,V02,Viện nghiên cứu,Công lập,"Vietnam Research Institute of Electronics, Informatics and Automation","Viện Nghiên cứu Điện tử, Tin học, Tự động hoá",Hà Nội,https://www.vielina.com/
Bộ Công Thương,V17,Viện nghiên cứu,Công lập,Viet Nam Institute of Industrial and Trade Policy and Strategy - VIOIT,"Viện Nghiên cứu Chiến lược, Chính sách Công Thương",Hà Nội,http://www.viennghiencuuthuongmai.com.vn/
Bộ Giao thông vận tải,V13,Viện nghiên cứu,Công lập,Institute of Transport Science and Technology,Viện Khoa học và Công nghệ Giao thông vận tải,Hà Nội,http://itst.gov.vn/
Bộ Công Thương,V49,Viện nghiên cứu,Công lập,National Research Institute Of Mechanical Engineering,Viện Nghiên cứu Cơ khí,Hà Nội,http://narime.gov.vn
Bộ Công Thương,V48,Viện nghiên cứu,Công lập,Industrial Machinery And Instruments Holding,Viện Máy và Dụng cụ công nghiệp,Hà Nội,http://imi-holding.com/
Bộ Khoa học và Công nghệ,V04,Viện nghiên cứu,Công lập,Vietnam Atomic Energy Institute,Viện Năng lượng nguyên tử Việt Nam,Hà Nội,http://www.vaec.gov.vn/
Bộ Nông nghiệp và Phát triển nông thôn,V62,Viện nghiên cứu,Công lập,Research Institute for Marine Fisheries,Viện Nghiên cứu hải sản,Hải Phòng,http://rimf.org.vn/
Bộ Y tế,VYL,Viện nghiên cứu,Công lập,National Institute of Occupational and Environmental Health,Viện Sức khoẻ nghề nghiệp và môi trường,Hà Nội,http://www.nioeh.org.vn/
Bộ Nông nghiệp và Phát triển nông thôn,VTY,Viện nghiên cứu,Công lập,National Institute of Veterinary Research,Viện Thú y,Hà Nội,http://vienthuy.gov.vn
Bộ Y tế,V25,Viện nghiên cứu,Công lập,National Instutte of Malariology Parasitology and Entomology,Viện Sốt rét - Ký sinh trùng - Côn trùng Trung ương,Hà Nội,http://nimpe.vn/
Bộ Nông nghiệp và Phát triển nông thôn,VTS,Viện nghiên cứu,Công lập,Research Institute for Aquaculture No1,Viện Nghiên cứu Nuôi trồng thuỷ sản I,Bắc Ninh,http://ria1.org
Viện Hàn lâm Khoa học và Công nghệ Việt Nam,V59,Viện nghiên cứu,Công lập,Institute of Mathematics,Viện Toán học,Hà Nội,http://math.ac.vn/
Bộ Kế hoạch và Đầu tư,V18,Viện nghiên cứu,Công lập,Central Institute for Economic Management (CIEM),Viện Nghiên cứu quản lý kinh tế Trung ương,Hà Nội,http://www.ciem.org.vn/
Bộ Khoa học và Công nghệ,VUD,Viện nghiên cứu,Công lập,National Center for Technology Progress,Viện Ứng dụng Công nghệ,Hà Nội,http://nacentech.vn/
"Bộ Văn hóa, Thể thao và Du lịch",V45,Viện nghiên cứu,Công lập,Vietnam National Institute of Culture and Arts Studies,Viện Văn hoá Nghệ thuật quốc gia Việt Nam,Hà Nội,www.vicas.org.vn
Bộ Y tế,V27,Viện nghiên cứu,Công lập,National Institute of Hygiene and Epidemiology,Viện Vệ sinh Dịch tễ Trung ương,Hà Nội,https://nihe.org.vn/
Bộ Nông nghiệp và Phát triển nông thôn,VKN,Viện nghiên cứu,Công lập,Vietnam Academy of Agriculture Sciences,Viện Khoa học Nông nghiệp Việt Nam,Hà Nội,https://vaas.vn/
Bộ Y tế,V26,Viện nghiên cứu,Công lập,Pasteur Institute in Ho Chi Minh City,Viện Pasteur Thành phố Hồ Chí Minh,TP. Hồ Chí Minh,http://www.pasteurhcm.gov.vn/
